{
  "goal_id": "playtest-login-path-v1",
  "desired": [
    {
      "id": "log-has-def",
      "kind": "command",
      "run": "grep -q 'def login' playtest/step-log.txt",
      "weight": 1.0
    },
    {
      "id": "final-state",
      "kind": "command",
      "run": "grep -q 'ok=true' playtest/final-state.txt",
      "weight": 1.0
    }
  ],
  "constraints": [],
  "context": "Drive the login path and record UI assertions plus a final state predicate.",
  "task_class": "playtest-operator"
}
