{
  "goal_id": "repro-evidence-pack-v1",
  "desired": [
    {
      "id": "steps-exist",
      "kind": "file_exists",
      "path": "evidence/steps.txt",
      "weight": 1.0
    },
    {
      "id": "notes-exist",
      "kind": "file_exists",
      "path": "evidence/network-notes.txt",
      "weight": 1.0
    }
  ],
  "constraints": [],
  "context": "Produce a self-contained bug-reproduction evidence pack from the failing fixture.",
  "task_class": "bug_reproduction"
}
